
root@lamp-ubuntu-s-1vcpu-1gb-tor1-01:~# tcpdump -n -i eth0
tcpdump: verbose output suppressed, use -v or -vv for full protocol decode
listening on eth0, link-type EN10MB (Ethernet), capture size 262144 bytes
20:05:58.324945 IP 138.197.133.108.22 > 162.243.188.66.58569: Flags [P.], seq 359473440:359473568, ack 2618920973, win 502, options [nop,nop,TS val 2567627611 ecr 1829436589], length 128
20:05:58.325095 IP 138.197.133.108.22 > 162.243.188.66.58569: Flags [P.], seq 128:192, ack 1, win 502, options [nop,nop,TS val 2567627611 ecr 1829436589], length 64
20:05:58.325138 IP 138.197.133.108.22 > 162.243.188.66.58569: Flags [P.], seq 192:320, ack 1, win 502, options [nop,nop,TS val 2567627611 ecr 1829436589], length 128
20:05:58.325260 IP 138.197.133.108.22 > 162.243.188.66.58569: Flags [P.], seq 320:384, ack 1, win 502, options [nop,nop,TS val 2567627611 ecr 1829436589], length 64
20:05:58.325427 IP 138.197.133.108.22 > 162.243.188.66.58569: Flags [P.], seq 384:624, ack 1, win 502, options [nop,nop,TS val 2567627611 ecr 1829436589], length 240
20:05:58.325524 IP 138.197.133.108.22 > 162.243.188.66.58569: Flags [P.], seq 624:688, ack 1, win 502, options [nop,nop,TS val 2567627611 ecr 1829436589], length 64
20:05:58.325641 IP 138.197.133.108.22 > 162.243.188.66.58569: Flags [P.], seq 688:912, ack 1, win 502, options [nop,nop,TS val 2567627611 ecr 1829436589], length 224
20:05:58.325721 IP 138.197.133.108.22 > 162.243.188.66.58569: Flags [P.], seq 912:976, ack 1, win 502, options [nop,nop,TS val 2567627611 ecr 1829436589], length 64
20:05:58.325818 IP 138.197.133.108.22 > 162.243.188.66.58569: Flags [P.], seq 976:1200, ack 1, win 502, options [nop,nop,TS val 2567627612 ecr 1829436589], length 224
20:05:58.329511 IP 162.243.188.66.58569 > 138.197.133.108.22: Flags [.], ack 0, win 501, options [nop,nop,TS val 1829436615 ecr 2567627602], length 0
20:05:58.329560 IP 138.197.133.108.22 > 162.243.188.66.58569: Flags [P.], seq 1200:2992, ack 1, win 502, options [nop,nop,TS val 2567627615 ecr 1829436615], length 1792
20:05:58.338144 IP 162.243.188.66.58569 > 138.197.133.108.22: Flags [.], ack 128, win 501, options [nop,nop,TS val 1829436624 ecr 2567627611], length 0
20:05:58.338194 IP 138.197.133.108.22 > 162.243.188.66.58569: Flags [P.], seq 2992:3376, ack 1, win 502, options [nop,nop,TS val 2567627624 ecr 1829436624], length 384
20:05:58.338366 IP 162.243.188.66.58569 > 138.197.133.108.22: Flags [.], ack 192, win 501, options [nop,nop,TS val 1829436624 ecr 2567627611], length 0
20:05:58.338366 IP 162.243.188.66.58569 > 138.197.133.108.22: Flags [.], ack 320, win 501, options [nop,nop,TS val 1829436624 ecr 2567627611], length 0
20:05:58.338366 IP 162.243.188.66.58569 > 138.197.133.108.22: Flags [.], ack 384, win 501, options [nop,nop,TS val 1829436624 ecr 2567627611], length 0
20:05:58.338409 IP 162.243.188.66.58569 > 138.197.133.108.22: Flags [.], ack 624, win 501, options [nop,nop,TS val 1829436624 ecr 2567627611], length 0
20:05:58.338409 IP 162.243.188.66.58569 > 138.197.133.108.22: Flags [.], ack 688, win 501, options [nop,nop,TS val 1829436624 ecr 2567627611], length 0
20:05:58.338465 IP 138.197.133.108.22 > 162.243.188.66.58569: Flags [P.], seq 3376:3760, ack 1, win 502, options [nop,nop,TS val 2567627624 ecr 1829436624], length 384
20:05:58.338493 IP 162.243.188.66.58569 > 138.197.133.108.22: Flags [.], ack 912, win 501, options [nop,nop,TS val 1829436624 ecr 2567627611], length 0
20:05:58.338574 IP 162.243.188.66.58569 > 138.197.133.108.22: Flags [.], ack 976, win 501, options [nop,nop,TS val 1829436624 ecr 2567627611], length 0
20:05:58.338648 IP 162.243.188.66.58569 > 138.197.133.108.22: Flags [.], ack 1200, win 501, options [nop,nop,TS val 1829436624 ecr 2567627612], length 0
20:05:58.338776 IP 138.197.133.108.22 > 162.243.188.66.58569: Flags [P.], seq 3760:5216, ack 1, win 502, options [nop,nop,TS val 2567627624 ecr 1829436624], length 1456
20:05:58.338904 IP 138.197.133.108.22 > 162.243.188.66.58569: Flags [P.], seq 5216:5440, ack 1, win 502, options [nop,nop,TS val 2567627625 ecr 1829436624], length 224
20:05:58.339033 IP 138.197.133.108.22 > 162.243.188.66.58569: Flags [P.], seq 5440:5664, ack 1, win 502, options [nop,nop,TS val 2567627625 ecr 1829436624], length 224
20:05:58.339156 IP 138.197.133.108.22 > 162.243.188.66.58569: Flags [P.], seq 5664:5888, ack 1, win 502, options [nop,nop,TS val 2567627625 ecr 1829436624], length 224
20:05:58.339336 IP 138.197.133.108.22 > 162.243.188.66.58569: Flags [P.], seq 5888:6112, ack 1, win 502, options [nop,nop,TS val 2567627625 ecr 1829436624], length 224
20:05:58.339455 IP 138.197.133.108.22 > 162.243.188.66.58569: Flags [P.], seq 6112:6336, ack 1, win 502, options [nop,nop,TS val 2567627625 ecr 1829436624], length 224
20:05:58.339538 IP 138.197.133.108.22 > 162.243.188.66.58569: Flags [P.], seq 6336:6400, ack 1, win 502, options [nop,nop,TS val 2567627625 ecr 1829436624], length 64
20:05:58.339653 IP 138.197.133.108.22 > 162.243.188.66.58569: Flags [P.], seq 6400:6624, ack 1, win 502, options [nop,nop,TS val 2567627625 ecr 1829436624], length 224
20:05:58.339773 IP 138.197.133.108.22 > 162.243.188.66.58569: Flags [P.], seq 6624:6688, ack 1, win 502, options [nop,nop,TS val 2567627625 ecr 1829436624], length 64
20:05:58.339867 IP 138.197.133.108.22 > 162.243.188.66.58569: Flags [P.], seq 6688:6912, ack 1, win 502, options [nop,nop,TS val 2567627626 ecr 1829436624], length 224
20:05:58.339946 IP 138.197.133.108.22 > 162.243.188.66.58569: Flags [P.], seq 6912:6976, ack 1, win 502, options [nop,nop,TS val 2567627626 ecr 1829436624], length 64
20:05:58.340037 IP 138.197.133.108.22 > 162.243.188.66.58569: Flags [P.], seq 6976:7200, ack 1, win 502, options [nop,nop,TS val 2567627626 ecr 1829436624], length 224
20:05:58.340131 IP 138.197.133.108.22 > 162.243.188.66.58569: Flags [P.], seq 7200:7264, ack 1, win 502, options [nop,nop,TS val 2567627626 ecr 1829436624], length 64
20:05:58.340224 IP 138.197.133.108.22 > 162.243.188.66.58569: Flags [P.], seq 7264:7488, ack 1, win 502, options [nop,nop,TS val 2567627626 ecr 1829436624], length 224
20:05:58.340352 IP 138.197.133.108.22 > 162.243.188.66.58569: Flags [P.], seq 7488:7776, ack 1, win 502, options [nop,nop,TS val 2567627626 ecr 1829436624], length 288
20:05:58.342605 IP 162.243.188.66.58569 > 138.197.133.108.22: Flags [.], ack 2648, win 501, options [nop,nop,TS val 1829436628 ecr 2567627615], length 0
20:05:58.342633 IP 138.197.133.108.22 > 162.243.188.66.58569: Flags [P.], seq 7776:9280, ack 1, win 502, options [nop,nop,TS val 2567627628 ecr 1829436628], length 1504
20:05:58.342716 IP 162.243.188.66.58569 > 138.197.133.108.22: Flags [.], ack 2992, win 499, options [nop,nop,TS val 1829436628 ecr 2567627615], length 0
20:05:58.342769 IP 138.197.133.108.22 > 162.243.188.66.58569: Flags [P.], seq 9280:9488, ack 1, win 502, options [nop,nop,TS val 2567627628 ecr 1829436628], length 208
20:05:58.342840 IP 138.197.133.108.22 > 162.243.188.66.58569: Flags [P.], seq 9488:9552, ack 1, win 502, options [nop,nop,TS val 2567627629 ecr 1829436628], length 64
20:05:58.351459 IP 162.243.188.66.58569 > 138.197.133.108.22: Flags [.], ack 3376, win 501, options [nop,nop,TS val 1829436637 ecr 2567627624], length 0
20:05:58.351508 IP 138.197.133.108.22 > 162.243.188.66.58569: Flags [P.], seq 9552:10688, ack 1, win 502, options [nop,nop,TS val 2567627637 ecr 1829436637], length 1136
20:05:58.351545 IP 162.243.188.66.58569 > 138.197.133.108.22: Flags [.], ack 3760, win 501, options [nop,nop,TS val 1829436637 ecr 2567627624], length 0
20:05:58.351685 IP 162.243.188.66.58569 > 138.197.133.108.22: Flags [.], ack 5216, win 490, options [nop,nop,TS val 1829436637 ecr 2567627624], length 0
20:05:58.351700 IP 138.197.133.108.22 > 162.243.188.66.58569: Flags [P.], seq 10688:10896, ack 1, win 502, options [nop,nop,TS val 2567627637 ecr 1829436637], length 208
20:05:58.351778 IP 162.243.188.66.58569 > 138.197.133.108.22: Flags [.], ack 5440, win 489, options [nop,nop,TS val 1829436637 ecr 2567627625], length 0
20:05:58.351821 IP 138.197.133.108.22 > 162.243.188.66.58569: Flags [P.], seq 10896:10960, ack 1, win 502, options [nop,nop,TS val 2567627638 ecr 1829436637], length 64
20:05:58.351931 IP 138.197.133.108.22 > 162.243.188.66.58569: Flags [P.], seq 10960:11184, ack 1, win 502, options [nop,nop,TS val 2567627638 ecr 1829436637], length 224
20:05:58.352017 IP 138.197.133.108.22 > 162.243.188.66.58569: Flags [P.], seq 11184:11248, ack 1, win 502, options [nop,nop,TS val 2567627638 ecr 1829436637], length 64
20:05:58.352143 IP 138.197.133.108.22 > 162.243.188.66.58569: Flags [P.], seq 11248:11456, ack 1, win 502, options [nop,nop,TS val 2567627638 ecr 1829436637], length 208
20:05:58.352236 IP 138.197.133.108.22 > 162.243.188.66.58569: Flags [P.], seq 11456:11520, ack 1, win 502, options [nop,nop,TS val 2567627638 ecr 1829436637], length 64
20:05:58.352337 IP 138.197.133.108.22 > 162.243.188.66.58569: Flags [P.], seq 11520:11728, ack 1, win 502, options [nop,nop,TS val 2567627638 ecr 1829436637], length 208
20:05:58.352413 IP 138.197.133.108.22 > 162.243.188.66.58569: Flags [P.], seq 11728:11792, ack 1, win 502, options [nop,nop,TS val 2567627638 ecr 1829436637], length 64
20:05:58.352540 IP 138.197.133.108.22 > 162.243.188.66.58569: Flags [P.], seq 11792:12016, ack 1, win 502, options [nop,nop,TS val 2567627638 ecr 1829436637], length 224
20:05:58.352678 IP 162.243.188.66.58569 > 138.197.133.108.22: Flags [.], ack 6912, win 478, options [nop,nop,TS val 1829436638 ecr 2567627625], length 0
20:05:58.352703 IP 138.197.133.108.22 > 162.243.188.66.58569: Flags [P.], seq 12016:12080, ack 1, win 502, options [nop,nop,TS val 2567627638 ecr 1829436638], length 64
20:05:58.352741 IP 138.197.133.108.22 > 162.243.188.66.58569: Flags [P.], seq 12080:12288, ack 1, win 502, options [nop,nop,TS val 2567627638 ecr 1829436638], length 208
20:05:58.352823 IP 138.197.133.108.22 > 162.243.188.66.58569: Flags [P.], seq 12288:12352, ack 1, win 502, options [nop,nop,TS val 2567627639 ecr 1829436638], length 64
20:05:58.352926 IP 138.197.133.108.22 > 162.243.188.66.58569: Flags [P.], seq 12352:12576, ack 1, win 502, options [nop,nop,TS val 2567627639 ecr 1829436638], length 224
20:05:58.353003 IP 138.197.133.108.22 > 162.243.188.66.58569: Flags [P.], seq 12576:12640, ack 1, win 502, options [nop,nop,TS val 2567627639 ecr 1829436638], length 64
20:05:58.353126 IP 138.197.133.108.22 > 162.243.188.66.58569: Flags [P.], seq 12640:12864, ack 1, win 502, options [nop,nop,TS val 2567627639 ecr 1829436638], length 224
20:05:58.353208 IP 138.197.133.108.22 > 162.243.188.66.58569: Flags [P.], seq 12864:12928, ack 1, win 502, options [nop,nop,TS val 2567627639 ecr 1829436638], length 64
20:05:58.353297 IP 138.197.133.108.22 > 162.243.188.66.58569: Flags [P.], seq 12928:13152, ack 1, win 502, options [nop,nop,TS val 2567627639 ecr 1829436638], length 224
20:05:58.353373 IP 138.197.133.108.22 > 162.243.188.66.58569: Flags [P.], seq 13152:13216, ack 1, win 502, options [nop,nop,TS val 2567627639 ecr 1829436638], length 64
20:05:58.353465 IP 138.197.133.108.22 > 162.243.188.66.58569: Flags [P.], seq 13216:13440, ack 1, win 502, options [nop,nop,TS val 2567627639 ecr 1829436638], length 224
20:05:58.353534 IP 138.197.133.108.22 > 162.243.188.66.58569: Flags [P.], seq 13440:13504, ack 1, win 502, options [nop,nop,TS val 2567627639 ecr 1829436638], length 64
20:05:58.353624 IP 138.197.133.108.22 > 162.243.188.66.58569: Flags [P.], seq 13504:13728, ack 1, win 502, options [nop,nop,TS val 2567627639 ecr 1829436638], length 224
20:05:58.353691 IP 138.197.133.108.22 > 162.243.188.66.58569: Flags [P.], seq 13728:13792, ack 1, win 502, options [nop,nop,TS val 2567627639 ecr 1829436638], length 64
20:05:58.353778 IP 138.197.133.108.22 > 162.243.188.66.58569: Flags [P.], seq 13792:14016, ack 1, win 502, options [nop,nop,TS val 2567627639 ecr 1829436638], length 224
20:05:58.353843 IP 138.197.133.108.22 > 162.243.188.66.58569: Flags [P.], seq 14016:14080, ack 1, win 502, options [nop,nop,TS val 2567627640 ecr 1829436638], length 64
20:05:58.353930 IP 138.197.133.108.22 > 162.243.188.66.58569: Flags [P.], seq 14080:14304, ack 1, win 502, options [nop,nop,TS val 2567627640 ecr 1829436638], length 224
20:05:58.355560 IP 162.243.188.66.58569 > 138.197.133.108.22: Flags [.], ack 9224, win 460, options [nop,nop,TS val 1829436641 ecr 2567627626], length 0
20:05:58.355592 IP 138.197.133.108.22 > 162.243.188.66.58569: Flags [P.], seq 14304:19536, ack 1, win 502, options [nop,nop,TS val 2567627641 ecr 1829436641], length 5232
20:05:58.355725 IP 138.197.133.108.22 > 162.243.188.66.58569: Flags [P.], seq 19536:19744, ack 1, win 502, options [nop,nop,TS val 2567627641 ecr 1829436641], length 208
20:05:58.355803 IP 138.197.133.108.22 > 162.243.188.66.58569: Flags [P.], seq 19744:19808, ack 1, win 502, options [nop,nop,TS val 2567627642 ecr 1829436641], length 64
20:05:58.355904 IP 138.197.133.108.22 > 162.243.188.66.58569: Flags [P.], seq 19808:20032, ack 1, win 502, options [nop,nop,TS val 2567627642 ecr 1829436641], length 224
20:05:58.355977 IP 138.197.133.108.22 > 162.243.188.66.58569: Flags [P.], seq 20032:20096, ack 1, win 502, options [nop,nop,TS val 2567627642 ecr 1829436641], length 64
20:05:58.356112 IP 138.197.133.108.22 > 162.243.188.66.58569: Flags [P.], seq 20096:20320, ack 1, win 502, options [nop,nop,TS val 2567627642 ecr 1829436641], length 224
20:05:58.356196 IP 138.197.133.108.22 > 162.243.188.66.58569: Flags [P.], seq 20320:20384, ack 1, win 502, options [nop,nop,TS val 2567627642 ecr 1829436641], length 64
20:05:58.356303 IP 138.197.133.108.22 > 162.243.188.66.58569: Flags [P.], seq 20384:20608, ack 1, win 502, options [nop,nop,TS val 2567627642 ecr 1829436641], length 224
20:05:58.365273 IP 162.243.188.66.58569 > 138.197.133.108.22: Flags [.], ack 10688, win 449, options [nop,nop,TS val 1829436651 ecr 2567627628], length 0
20:05:58.365434 IP 138.197.133.108.22 > 162.243.188.66.58569: Flags [P.], seq 20608:21648, ack 1, win 502, options [nop,nop,TS val 2567627651 ecr 1829436651], length 1040
20:05:58.365528 IP 138.197.133.108.22 > 162.243.188.66.58569: Flags [P.], seq 21648:21856, ack 1, win 502, options [nop,nop,TS val 2567627651 ecr 1829436651], length 208
20:05:58.365673 IP 138.197.133.108.22 > 162.243.188.66.58569: Flags [P.], seq 21856:22256, ack 1, win 502, options [nop,nop,TS val 2567627651 ecr 1829436651], length 400
20:05:58.365804 IP 138.197.133.108.22 > 162.243.188.66.58569: Flags [P.], seq 22256:22480, ack 1, win 502, options [nop,nop,TS val 2567627652 ecr 1829436651], length 224
20:05:58.365877 IP 162.243.188.66.58569 > 138.197.133.108.22: Flags [.], ack 12288, win 437, options [nop,nop,TS val 1829436651 ecr 2567627637], length 0
20:05:58.366035 IP 138.197.133.108.22 > 162.243.188.66.58569: Flags [P.], seq 22480:22864, ack 1, win 502, options [nop,nop,TS val 2567627652 ecr 1829436651], length 384
20:05:58.366196 IP 138.197.133.108.22 > 162.243.188.66.58569: Flags [P.], seq 22864:23088, ack 1, win 502, options [nop,nop,TS val 2567627652 ecr 1829436651], length 224
20:05:58.366321 IP 138.197.133.108.22 > 162.243.188.66.58569: Flags [P.], seq 23088:23312, ack 1, win 502, options [nop,nop,TS val 2567627652 ecr 1829436651], length 224
20:05:58.366435 IP 138.197.133.108.22 > 162.243.188.66.58569: Flags [P.], seq 23312:23536, ack 1, win 502, options [nop,nop,TS val 2567627652 ecr 1829436651], length 224
20:05:58.366461 IP 162.243.188.66.58569 > 138.197.133.108.22: Flags [.], ack 13792, win 426, options [nop,nop,TS val 1829436652 ecr 2567627639], length 0
20:05:58.366611 IP 138.197.133.108.22 > 162.243.188.66.58569: Flags [P.], seq 23536:23920, ack 1, win 502, options [nop,nop,TS val 2567627652 ecr 1829436652], length 384
20:05:58.366733 IP 138.197.133.108.22 > 162.243.188.66.58569: Flags [P.], seq 23920:24144, ack 1, win 502, options [nop,nop,TS val 2567627652 ecr 1829436652], length 224
20:05:58.366857 IP 138.197.133.108.22 > 162.243.188.66.58569: Flags [P.], seq 24144:24368, ack 1, win 502, options [nop,nop,TS val 2567627653 ecr 1829436652], length 224
20:05:58.366975 IP 138.197.133.108.22 > 162.243.188.66.58569: Flags [P.], seq 24368:24592, ack 1, win 502, options [nop,nop,TS val 2567627653 ecr 1829436652], length 224
20:05:58.367103 IP 138.197.133.108.22 > 162.243.188.66.58569: Flags [P.], seq 24592:24816, ack 1, win 502, options [nop,nop,TS val 2567627653 ecr 1829436652], length 224
20:05:58.367233 IP 138.197.133.108.22 > 162.243.188.66.58569: Flags [P.], seq 24816:25040, ack 1, win 502, options [nop,nop,TS val 2567627653 ecr 1829436652], length 224
20:05:58.367355 IP 138.197.133.108.22 > 162.243.188.66.58569: Flags [P.], seq 25040:25264, ack 1, win 502, options [nop,nop,TS val 2567627653 ecr 1829436652], length 224
20:05:58.367480 IP 138.197.133.108.22 > 162.243.188.66.58569: Flags [P.], seq 25264:25488, ack 1, win 502, options [nop,nop,TS val 2567627653 ecr 1829436652], length 224
20:05:58.367605 IP 138.197.133.108.22 > 162.243.188.66.58569: Flags [P.], seq 25488:25712, ack 1, win 502, options [nop,nop,TS val 2567627653 ecr 1829436652], length 224
20:05:58.367724 IP 138.197.133.108.22 > 162.243.188.66.58569: Flags [P.], seq 25712:25936, ack 1, win 502, options [nop,nop,TS val 2567627653 ecr 1829436652], length 224
20:05:58.367841 IP 138.197.133.108.22 > 162.243.188.66.58569: Flags [P.], seq 25936:26160, ack 1, win 502, options [nop,nop,TS val 2567627654 ecr 1829436652], length 224
20:05:58.367964 IP 138.197.133.108.22 > 162.243.188.66.58569: Flags [P.], seq 26160:26384, ack 1, win 502, options [nop,nop,TS val 2567627654 ecr 1829436652], length 224
20:05:58.368104 IP 138.197.133.108.22 > 162.243.188.66.58569: Flags [P.], seq 26384:26608, ack 1, win 502, options [nop,nop,TS val 2567627654 ecr 1829436652], length 224
20:05:58.368223 IP 138.197.133.108.22 > 162.243.188.66.58569: Flags [P.], seq 26608:26832, ack 1, win 502, options [nop,nop,TS val 2567627654 ecr 1829436652], length 224
20:05:58.368391 IP 138.197.133.108.22 > 162.243.188.66.58569: Flags [P.], seq 26832:27056, ack 1, win 502, options [nop,nop,TS val 2567627654 ecr 1829436652], length 224
20:05:58.368477 IP 162.243.188.66.58569 > 138.197.133.108.22: Flags [.], ack 15752, win 411, options [nop,nop,TS val 1829436654 ecr 2567627639], length 0
20:05:58.368574 IP 162.243.188.66.58569 > 138.197.133.108.22: Flags [.], ack 19744, win 380, options [nop,nop,TS val 1829436654 ecr 2567627641], length 0
20:05:58.368628 IP 138.197.133.108.22 > 162.243.188.66.58569: Flags [P.], seq 27056:27440, ack 1, win 502, options [nop,nop,TS val 2567627654 ecr 1829436654], length 384
20:05:58.368779 IP 138.197.133.108.22 > 162.243.188.66.58569: Flags [P.], seq 27440:27824, ack 1, win 502, options [nop,nop,TS val 2567627654 ecr 1829436654], length 384
20:05:58.368896 IP 138.197.133.108.22 > 162.243.188.66.58569: Flags [P.], seq 27824:28048, ack 1, win 502, options [nop,nop,TS val 2567627655 ecr 1829436654], length 224
20:05:58.369019 IP 138.197.133.108.22 > 162.243.188.66.58569: Flags [P.], seq 28048:28272, ack 1, win 502, options [nop,nop,TS val 2567627655 ecr 1829436654], length 224
20:05:58.369166 IP 138.197.133.108.22 > 162.243.188.66.58569: Flags [P.], seq 28272:28496, ack 1, win 502, options [nop,nop,TS val 2567627655 ecr 1829436654], length 224
20:05:58.369323 IP 138.197.133.108.22 > 162.243.188.66.58569: Flags [P.], seq 28496:28720, ack 1, win 502, options [nop,nop,TS val 2567627655 ecr 1829436654], length 224
20:05:58.369441 IP 138.197.133.108.22 > 162.243.188.66.58569: Flags [P.], seq 28720:28944, ack 1, win 502, options [nop,nop,TS val 2567627655 ecr 1829436654], length 224
20:05:58.369559 IP 138.197.133.108.22 > 162.243.188.66.58569: Flags [P.], seq 28944:29168, ack 1, win 502, options [nop,nop,TS val 2567627655 ecr 1829436654], length 224
20:05:58.369685 IP 138.197.133.108.22 > 162.243.188.66.58569: Flags [P.], seq 29168:29392, ack 1, win 502, options [nop,nop,TS val 2567627655 ecr 1829436654], length 224
20:05:58.369810 IP 138.197.133.108.22 > 162.243.188.66.58569: Flags [P.], seq 29392:29616, ack 1, win 502, options [nop,nop,TS val 2567627656 ecr 1829436654], length 224
20:05:58.369925 IP 138.197.133.108.22 > 162.243.188.66.58569: Flags [P.], seq 29616:29840, ack 1, win 502, options [nop,nop,TS val 2567627656 ecr 1829436654], length 224
20:05:58.370047 IP 138.197.133.108.22 > 162.243.188.66.58569: Flags [P.], seq 29840:30064, ack 1, win 502, options [nop,nop,TS val 2567627656 ecr 1829436654], length 224
20:05:58.370169 IP 138.197.133.108.22 > 162.243.188.66.58569: Flags [P.], seq 30064:30288, ack 1, win 502, options [nop,nop,TS val 2567627656 ecr 1829436654], length 224
20:05:58.370285 IP 138.197.133.108.22 > 162.243.188.66.58569: Flags [P.], seq 30288:30512, ack 1, win 502, options [nop,nop,TS val 2567627656 ecr 1829436654], length 224
20:05:58.370409 IP 138.197.133.108.22 > 162.243.188.66.58569: Flags [P.], seq 30512:30736, ack 1, win 502, options [nop,nop,TS val 2567627656 ecr 1829436654], length 224
20:05:58.370534 IP 138.197.133.108.22 > 162.243.188.66.58569: Flags [P.], seq 30736:30960, ack 1, win 502, options [nop,nop,TS val 2567627656 ecr 1829436654], length 224
20:05:58.370652 IP 138.197.133.108.22 > 162.243.188.66.58569: Flags [P.], seq 30960:31184, ack 1, win 502, options [nop,nop,TS val 2567627656 ecr 1829436654], length 224
20:05:58.370761 IP 138.197.133.108.22 > 162.243.188.66.58569: Flags [P.], seq 31184:31408, ack 1, win 502, options [nop,nop,TS val 2567627656 ecr 1829436654], length 224
20:05:58.370880 IP 138.197.133.108.22 > 162.243.188.66.58569: Flags [P.], seq 31408:31632, ack 1, win 502, options [nop,nop,TS val 2567627657 ecr 1829436654], length 224
20:05:58.370993 IP 138.197.133.108.22 > 162.243.188.66.58569: Flags [P.], seq 31632:31856, ack 1, win 502, options [nop,nop,TS val 2567627657 ecr 1829436654], length 224
20:05:58.371105 IP 138.197.133.108.22 > 162.243.188.66.58569: Flags [P.], seq 31856:32080, ack 1, win 502, options [nop,nop,TS val 2567627657 ecr 1829436654], length 224
20:05:58.371232 IP 138.197.133.108.22 > 162.243.188.66.58569: Flags [P.], seq 32080:32304, ack 1, win 502, options [nop,nop,TS val 2567627657 ecr 1829436654], length 224
20:05:58.371359 IP 138.197.133.108.22 > 162.243.188.66.58569: Flags [P.], seq 32304:32528, ack 1, win 502, options [nop,nop,TS val 2567627657 ecr 1829436654], length 224
20:05:58.371511 IP 138.197.133.108.22 > 162.243.188.66.58569: Flags [P.], seq 32528:32752, ack 1, win 502, options [nop,nop,TS val 2567627657 ecr 1829436654], length 224
20:05:58.371623 IP 138.197.133.108.22 > 162.243.188.66.58569: Flags [P.], seq 32752:32976, ack 1, win 502, options [nop,nop,TS val 2567627657 ecr 1829436654], length 224
20:05:58.371744 IP 138.197.133.108.22 > 162.243.188.66.58569: Flags [P.], seq 32976:33200, ack 1, win 502, options [nop,nop,TS val 2567627657 ecr 1829436654], length 224
20:05:58.371880 IP 138.197.133.108.22 > 162.243.188.66.58569: Flags [P.], seq 33200:33424, ack 1, win 502, options [nop,nop,TS val 2567627658 ecr 1829436654], length 224
20:05:58.371996 IP 138.197.133.108.22 > 162.243.188.66.58569: Flags [P.], seq 33424:33648, ack 1, win 502, options [nop,nop,TS val 2567627658 ecr 1829436654], length 224
20:05:58.372142 IP 138.197.133.108.22 > 162.243.188.66.58569: Flags [P.], seq 33648:33872, ack 1, win 502, options [nop,nop,TS val 2567627658 ecr 1829436654], length 224
20:05:58.372266 IP 138.197.133.108.22 > 162.243.188.66.58569: Flags [P.], seq 33872:34096, ack 1, win 502, options [nop,nop,TS val 2567627658 ecr 1829436654], length 224
20:05:58.372392 IP 138.197.133.108.22 > 162.243.188.66.58569: Flags [P.], seq 34096:34320, ack 1, win 502, options [nop,nop,TS val 2567627658 ecr 1829436654], length 224
20:05:58.372531 IP 138.197.133.108.22 > 162.243.188.66.58569: Flags [P.], seq 34320:34544, ack 1, win 502, options [nop,nop,TS val 2567627658 ecr 1829436654], length 224
20:05:58.372644 IP 138.197.133.108.22 > 162.243.188.66.58569: Flags [P.], seq 34544:34768, ack 1, win 502, options [nop,nop,TS val 2567627658 ecr 1829436654], length 224
20:05:58.372764 IP 138.197.133.108.22 > 162.243.188.66.58569: Flags [P.], seq 34768:34992, ack 1, win 502, options [nop,nop,TS val 2567627658 ecr 1829436654], length 224
20:05:58.372908 IP 138.197.133.108.22 > 162.243.188.66.58569: Flags [P.], seq 34992:35216, ack 1, win 502, options [nop,nop,TS val 2567627659 ecr 1829436654], length 224
20:05:58.373023 IP 138.197.133.108.22 > 162.243.188.66.58569: Flags [P.], seq 35216:35440, ack 1, win 502, options [nop,nop,TS val 2567627659 ecr 1829436654], length 224
20:05:58.373138 IP 138.197.133.108.22 > 162.243.188.66.58569: Flags [P.], seq 35440:35664, ack 1, win 502, options [nop,nop,TS val 2567627659 ecr 1829436654], length 224
20:05:58.373258 IP 138.197.133.108.22 > 162.243.188.66.58569: Flags [P.], seq 35664:35888, ack 1, win 502, options [nop,nop,TS val 2567627659 ecr 1829436654], length 224
20:05:58.373367 IP 138.197.133.108.22 > 162.243.188.66.58569: Flags [P.], seq 35888:36112, ack 1, win 502, options [nop,nop,TS val 2567627659 ecr 1829436654], length 224
20:05:58.373477 IP 138.197.133.108.22 > 162.243.188.66.58569: Flags [P.], seq 36112:36336, ack 1, win 502, options [nop,nop,TS val 2567627659 ecr 1829436654], length 224
20:05:58.373614 IP 138.197.133.108.22 > 162.243.188.66.58569: Flags [P.], seq 36336:36560, ack 1, win 502, options [nop,nop,TS val 2567627659 ecr 1829436654], length 224
20:05:58.373729 IP 138.197.133.108.22 > 162.243.188.66.58569: Flags [P.], seq 36560:36784, ack 1, win 502, options [nop,nop,TS val 2567627659 ecr 1829436654], length 224
20:05:58.373845 IP 138.197.133.108.22 > 162.243.188.66.58569: Flags [P.], seq 36784:37008, ack 1, win 502, options [nop,nop,TS val 2567627660 ecr 1829436654], length 224
20:05:58.373961 IP 138.197.133.108.22 > 162.243.188.66.58569: Flags [P.], seq 37008:37232, ack 1, win 502, options [nop,nop,TS val 2567627660 ecr 1829436654], length 224
20:05:58.374078 IP 138.197.133.108.22 > 162.243.188.66.58569: Flags [P.], seq 37232:37456, ack 1, win 502, options [nop,nop,TS val 2567627660 ecr 1829436654], length 224
20:05:58.374190 IP 138.197.133.108.22 > 162.243.188.66.58569: Flags [P.], seq 37456:37680, ack 1, win 502, options [nop,nop,TS val 2567627660 ecr 1829436654], length 224
20:05:58.378432 IP 162.243.188.66.58569 > 138.197.133.108.22: Flags [.], ack 21648, win 366, options [nop,nop,TS val 1829436664 ecr 2567627642], length 0
20:05:58.378470 IP 138.197.133.108.22 > 162.243.188.66.58569: Flags [P.], seq 37680:37904, ack 1, win 502, options [nop,nop,TS val 2567627664 ecr 1829436664], length 224
20:05:58.378641 IP 138.197.133.108.22 > 162.243.188.66.58569: Flags [P.], seq 37904:38288, ack 1, win 502, options [nop,nop,TS val 2567627664 ecr 1829436664], length 384
20:05:58.378772 IP 138.197.133.108.22 > 162.243.188.66.58569: Flags [P.], seq 38288:38512, ack 1, win 502, options [nop,nop,TS val 2567627664 ecr 1829436664], length 224
20:05:58.378901 IP 138.197.133.108.22 > 162.243.188.66.58569: Flags [P.], seq 38512:38736, ack 1, win 502, options [nop,nop,TS val 2567627665 ecr 1829436664], length 224
20:05:58.379015 IP 138.197.133.108.22 > 162.243.188.66.58569: Flags [P.], seq 38736:38960, ack 1, win 502, options [nop,nop,TS val 2567627665 ecr 1829436664], length 224
20:05:58.379121 IP 162.243.188.66.58569 > 138.197.133.108.22: Flags [.], ack 23312, win 353, options [nop,nop,TS val 1829436665 ecr 2567627651], length 0
20:05:58.379186 IP 138.197.133.108.22 > 162.243.188.66.58569: Flags [P.], seq 38960:39184, ack 1, win 502, options [nop,nop,TS val 2567627665 ecr 1829436665], length 224
20:05:58.379338 IP 138.197.133.108.22 > 162.243.188.66.58569: Flags [P.], seq 39184:39568, ack 1, win 502, options [nop,nop,TS val 2567627665 ecr 1829436665], length 384
20:05:58.379456 IP 138.197.133.108.22 > 162.243.188.66.58569: Flags [P.], seq 39568:39792, ack 1, win 502, options [nop,nop,TS val 2567627665 ecr 1829436665], length 224
20:05:58.379573 IP 138.197.133.108.22 > 162.243.188.66.58569: Flags [P.], seq 39792:40016, ack 1, win 502, options [nop,nop,TS val 2567627665 ecr 1829436665], length 224
20:05:58.379689 IP 138.197.133.108.22 > 162.243.188.66.58569: Flags [P.], seq 40016:40240, ack 1, win 502, options [nop,nop,TS val 2567627665 ecr 1829436665], length 224
20:05:58.379807 IP 138.197.133.108.22 > 162.243.188.66.58569: Flags [P.], seq 40240:40464, ack 1, win 502, options [nop,nop,TS val 2567627666 ecr 1829436665], length 224
20:05:58.379920 IP 162.243.188.66.58569 > 138.197.133.108.22: Flags [.], ack 24816, win 342, options [nop,nop,TS val 1829436665 ecr 2567627652], length 0
20:05:58.379967 IP 138.197.133.108.22 > 162.243.188.66.58569: Flags [P.], seq 40464:40688, ack 1, win 502, options [nop,nop,TS val 2567627666 ecr 1829436665], length 224
20:05:58.380140 IP 138.197.133.108.22 > 162.243.188.66.58569: Flags [P.], seq 40688:41072, ack 1, win 502, options [nop,nop,TS val 2567627666 ecr 1829436665], length 384
20:05:58.380262 IP 138.197.133.108.22 > 162.243.188.66.58569: Flags [P.], seq 41072:41296, ack 1, win 502, options [nop,nop,TS val 2567627666 ecr 1829436665], length 224
20:05:58.380383 IP 138.197.133.108.22 > 162.243.188.66.58569: Flags [P.], seq 41296:41520, ack 1, win 502, options [nop,nop,TS val 2567627666 ecr 1829436665], length 224
20:05:58.380516 IP 138.197.133.108.22 > 162.243.188.66.58569: Flags [P.], seq 41520:41744, ack 1, win 502, options [nop,nop,TS val 2567627666 ecr 1829436665], length 224
20:05:58.380631 IP 138.197.133.108.22 > 162.243.188.66.58569: Flags [P.], seq 41744:41968, ack 1, win 502, options [nop,nop,TS val 2567627666 ecr 1829436665], length 224
20:05:58.380756 IP 138.197.133.108.22 > 162.243.188.66.58569: Flags [P.], seq 41968:42192, ack 1, win 502, options [nop,nop,TS val 2567627666 ecr 1829436665], length 224
20:05:58.380824 IP 162.243.188.66.58569 > 138.197.133.108.22: Flags [.], ack 26384, win 330, options [nop,nop,TS val 1829436666 ecr 2567627653], length 0
20:05:58.380936 IP 138.197.133.108.22 > 162.243.188.66.58569: Flags [P.], seq 42192:42576, ack 1, win 502, options [nop,nop,TS val 2567627667 ecr 1829436666], length 384
20:05:58.381062 IP 138.197.133.108.22 > 162.243.188.66.58569: Flags [P.], seq 42576:42800, ack 1, win 502, options [nop,nop,TS val 2567627667 ecr 1829436666], length 224
20:05:58.381186 IP 138.197.133.108.22 > 162.243.188.66.58569: Flags [P.], seq 42800:43024, ack 1, win 502, options [nop,nop,TS val 2567627667 ecr 1829436666], length 224
20:05:58.381295 IP 138.197.133.108.22 > 162.243.188.66.58569: Flags [P.], seq 43024:43248, ack 1, win 502, options [nop,nop,TS val 2567627667 ecr 1829436666], length 224
20:05:58.381411 IP 138.197.133.108.22 > 162.243.188.66.58569: Flags [P.], seq 43248:43472, ack 1, win 502, options [nop,nop,TS val 2567627667 ecr 1829436666], length 224
20:05:58.381539 IP 138.197.133.108.22 > 162.243.188.66.58569: Flags [P.], seq 43472:43696, ack 1, win 502, options [nop,nop,TS val 2567627667 ecr 1829436666], length 224
20:05:58.381649 IP 138.197.133.108.22 > 162.243.188.66.58569: Flags [P.], seq 43696:43920, ack 1, win 502, options [nop,nop,TS val 2567627667 ecr 1829436666], length 224
20:05:58.381712 IP 162.243.188.66.58569 > 138.197.133.108.22: Flags [.], ack 28048, win 317, options [nop,nop,TS val 1829436667 ecr 2567627654], length 0
20:05:58.381818 IP 138.197.133.108.22 > 162.243.188.66.58569: Flags [P.], seq 43920:44304, ack 1, win 502, options [nop,nop,TS val 2567627668 ecr 1829436667], length 384
20:05:58.381955 IP 138.197.133.108.22 > 162.243.188.66.58569: Flags [P.], seq 44304:44528, ack 1, win 502, options [nop,nop,TS val 2567627668 ecr 1829436667], length 224
20:05:58.382073 IP 138.197.133.108.22 > 162.243.188.66.58569: Flags [P.], seq 44528:44752, ack 1, win 502, options [nop,nop,TS val 2567627668 ecr 1829436667], length 224
20:05:58.382186 IP 138.197.133.108.22 > 162.243.188.66.58569: Flags [P.], seq 44752:44976, ack 1, win 502, options [nop,nop,TS val 2567627668 ecr 1829436667], length 224
20:05:58.382330 IP 138.197.133.108.22 > 162.243.188.66.58569: Flags [P.], seq 44976:45200, ack 1, win 502, options [nop,nop,TS val 2567627668 ecr 1829436667], length 224
20:05:58.382454 IP 138.197.133.108.22 > 162.243.188.66.58569: Flags [P.], seq 45200:45424, ack 1, win 502, options [nop,nop,TS val 2567627668 ecr 1829436667], length 224
20:05:58.382582 IP 138.197.133.108.22 > 162.243.188.66.58569: Flags [P.], seq 45424:45648, ack 1, win 502, options [nop,nop,TS val 2567627668 ecr 1829436667], length 224
20:05:58.382600 IP 162.243.188.66.58569 > 138.197.133.108.22: Flags [.], ack 29616, win 305, options [nop,nop,TS val 1829436668 ecr 2567627655], length 0
20:05:58.382735 IP 138.197.133.108.22 > 162.243.188.66.58569: Flags [P.], seq 45648:46032, ack 1, win 502, options [nop,nop,TS val 2567627668 ecr 1829436668], length 384
20:05:58.382866 IP 138.197.133.108.22 > 162.243.188.66.58569: Flags [P.], seq 46032:46256, ack 1, win 502, options [nop,nop,TS val 2567627669 ecr 1829436668], length 224
20:05:58.382986 IP 138.197.133.108.22 > 162.243.188.66.58569: Flags [P.], seq 46256:46480, ack 1, win 502, options [nop,nop,TS val 2567627669 ecr 1829436668], length 224
20:05:58.383098 IP 138.197.133.108.22 > 162.243.188.66.58569: Flags [P.], seq 46480:46704, ack 1, win 502, options [nop,nop,TS val 2567627669 ecr 1829436668], length 224
20:05:58.383219 IP 138.197.133.108.22 > 162.243.188.66.58569: Flags [P.], seq 46704:46928, ack 1, win 502, options [nop,nop,TS val 2567627669 ecr 1829436668], length 224
20:05:58.383348 IP 138.197.133.108.22 > 162.243.188.66.58569: Flags [P.], seq 46928:47152, ack 1, win 502, options [nop,nop,TS val 2567627669 ecr 1829436668], length 224
20:05:58.383470 IP 162.243.188.66.58569 > 138.197.133.108.22: Flags [.], ack 31184, win 293, options [nop,nop,TS val 1829436669 ecr 2567627656], length 0
20:05:58.383485 IP 138.197.133.108.22 > 162.243.188.66.58569: Flags [P.], seq 47152:47376, ack 1, win 502, options [nop,nop,TS val 2567627669 ecr 1829436668], length 224
20:05:58.383626 IP 138.197.133.108.22 > 162.243.188.66.58569: Flags [P.], seq 47376:47760, ack 1, win 502, options [nop,nop,TS val 2567627669 ecr 1829436669], length 384
20:05:58.383755 IP 138.197.133.108.22 > 162.243.188.66.58569: Flags [P.], seq 47760:47984, ack 1, win 502, options [nop,nop,TS val 2567627669 ecr 1829436669], length 224
20:05:58.383868 IP 138.197.133.108.22 > 162.243.188.66.58569: Flags [P.], seq 47984:48208, ack 1, win 502, options [nop,nop,TS val 2567627670 ecr 1829436669], length 224
20:05:58.383976 IP 138.197.133.108.22 > 162.243.188.66.58569: Flags [P.], seq 48208:48432, ack 1, win 502, options [nop,nop,TS val 2567627670 ecr 1829436669], length 224
20:05:58.384117 IP 138.197.133.108.22 > 162.243.188.66.58569: Flags [P.], seq 48432:48656, ack 1, win 502, options [nop,nop,TS val 2567627670 ecr 1829436669], length 224
20:05:58.384233 IP 138.197.133.108.22 > 162.243.188.66.58569: Flags [P.], seq 48656:48880, ack 1, win 502, options [nop,nop,TS val 2567627670 ecr 1829436669], length 224
20:05:58.384362 IP 162.243.188.66.58569 > 138.197.133.108.22: Flags [.], ack 32752, win 281, options [nop,nop,TS val 1829436670 ecr 2567627656], length 0
20:05:58.384476 IP 138.197.133.108.22 > 162.243.188.66.58569: Flags [P.], seq 48880:49104, ack 1, win 502, options [nop,nop,TS val 2567627670 ecr 1829436670], length 224
20:05:58.384618 IP 138.197.133.108.22 > 162.243.188.66.58569: Flags [P.], seq 49104:49312, ack 1, win 502, options [nop,nop,TS val 2567627670 ecr 1829436670], length 208
20:05:58.384733 IP 138.197.133.108.22 > 162.243.188.66.58569: Flags [P.], seq 49312:49536, ack 1, win 502, options [nop,nop,TS val 2567627670 ecr 1829436670], length 224
20:05:58.384840 IP 138.197.133.108.22 > 162.243.188.66.58569: Flags [P.], seq 49536:49760, ack 1, win 502, options [nop,nop,TS val 2567627671 ecr 1829436670], length 224
20:05:58.384894 IP 138.197.133.108.22 > 162.243.188.66.58569: Flags [P.], seq 49760:49984, ack 1, win 502, options [nop,nop,TS val 2567627671 ecr 1829436670], length 224
20:05:58.385030 IP 138.197.133.108.22 > 162.243.188.66.58569: Flags [P.], seq 49984:50384, ack 1, win 502, options [nop,nop,TS val 2567627671 ecr 1829436670], length 400
20:05:58.385185 IP 162.243.188.66.58569 > 138.197.133.108.22: Flags [.], ack 34320, win 269, options [nop,nop,TS val 1829436671 ecr 2567627657], length 0
20:05:58.385211 IP 138.197.133.108.22 > 162.243.188.66.58569: Flags [P.], seq 50384:50608, ack 1, win 502, options [nop,nop,TS val 2567627671 ecr 1829436671], length 224
20:05:58.385364 IP 138.197.133.108.22 > 162.243.188.66.58569: Flags [P.], seq 50608:50992, ack 1, win 502, options [nop,nop,TS val 2567627671 ecr 1829436671], length 384
20:05:58.385485 IP 138.197.133.108.22 > 162.243.188.66.58569: Flags [P.], seq 50992:51216, ack 1, win 502, options [nop,nop,TS val 2567627671 ecr 1829436671], length 224
20:05:58.385614 IP 138.197.133.108.22 > 162.243.188.66.58569: Flags [P.], seq 51216:51440, ack 1, win 502, options [nop,nop,TS val 2567627671 ecr 1829436671], length 224
20:05:58.385769 IP 138.197.133.108.22 > 162.243.188.66.58569: Flags [P.], seq 51440:51664, ack 1, win 502, options [nop,nop,TS val 2567627671 ecr 1829436671], length 224
20:05:58.385895 IP 138.197.133.108.22 > 162.243.188.66.58569: Flags [P.], seq 51664:51888, ack 1, win 502, options [nop,nop,TS val 2567627672 ecr 1829436671], length 224
20:05:58.386015 IP 138.197.133.108.22 > 162.243.188.66.58569: Flags [P.], seq 51888:52112, ack 1, win 502, options [nop,nop,TS val 2567627672 ecr 1829436671], length 224
20:05:58.386056 IP 162.243.188.66.58569 > 138.197.133.108.22: Flags [.], ack 35888, win 257, options [nop,nop,TS val 1829436671 ecr 2567627658], length 0
20:05:58.386195 IP 138.197.133.108.22 > 162.243.188.66.58569: Flags [P.], seq 52112:52496, ack 1, win 502, options [nop,nop,TS val 2567627672 ecr 1829436671], length 384
20:05:58.386322 IP 138.197.133.108.22 > 162.243.188.66.58569: Flags [P.], seq 52496:52720, ack 1, win 502, options [nop,nop,TS val 2567627672 ecr 1829436671], length 224
20:05:58.386439 IP 138.197.133.108.22 > 162.243.188.66.58569: Flags [P.], seq 52720:52944, ack 1, win 502, options [nop,nop,TS val 2567627672 ecr 1829436671], length 224
20:05:58.386560 IP 138.197.133.108.22 > 162.243.188.66.58569: Flags [P.], seq 52944:53168, ack 1, win 502, options [nop,nop,TS val 2567627672 ecr 1829436671], length 224
20:05:58.386674 IP 138.197.133.108.22 > 162.243.188.66.58569: Flags [P.], seq 53168:53392, ack 1, win 502, options [nop,nop,TS val 2567627672 ecr 1829436671], length 224
20:05:58.386781 IP 138.197.133.108.22 > 162.243.188.66.58569: Flags [P.], seq 53392:53616, ack 1, win 502, options [nop,nop,TS val 2567627672 ecr 1829436671], length 224
20:05:58.386912 IP 138.197.133.108.22 > 162.243.188.66.58569: Flags [P.], seq 53616:53840, ack 1, win 502, options [nop,nop,TS val 2567627673 ecr 1829436671], length 224
20:05:58.387023 IP 162.243.188.66.58569 > 138.197.133.108.22: Flags [.], ack 37456, win 245, options [nop,nop,TS val 1829436672 ecr 2567627659], length 0
20:05:58.387069 IP 138.197.133.108.22 > 162.243.188.66.58569: Flags [P.], seq 53840:54064, ack 1, win 502, options [nop,nop,TS val 2567627673 ecr 1829436672], length 224
20:05:58.387217 IP 138.197.133.108.22 > 162.243.188.66.58569: Flags [P.], seq 54064:54448, ack 1, win 502, options [nop,nop,TS val 2567627673 ecr 1829436672], length 384
20:05:58.387358 IP 138.197.133.108.22 > 162.243.188.66.58569: Flags [P.], seq 54448:54672, ack 1, win 502, options [nop,nop,TS val 2567627673 ecr 1829436672], length 224
20:05:58.387472 IP 138.197.133.108.22 > 162.243.188.66.58569: Flags [P.], seq 54672:54896, ack 1, win 502, options [nop,nop,TS val 2567627673 ecr 1829436672], length 224
20:05:58.387583 IP 138.197.133.108.22 > 162.243.188.66.58569: Flags [P.], seq 54896:55120, ack 1, win 502, options [nop,nop,TS val 2567627673 ecr 1829436672], length 224
20:05:58.387700 IP 138.197.133.108.22 > 162.243.188.66.58569: Flags [P.], seq 55120:55344, ack 1, win 502, options [nop,nop,TS val 2567627673 ecr 1829436672], length 224
20:05:58.387822 IP 138.197.133.108.22 > 162.243.188.66.58569: Flags [P.], seq 55344:55568, ack 1, win 502, options [nop,nop,TS val 2567627674 ecr 1829436672], length 224
20:05:58.387936 IP 138.197.133.108.22 > 162.243.188.66.58569: Flags [P.], seq 55568:55792, ack 1, win 502, options [nop,nop,TS val 2567627674 ecr 1829436672], length 224
20:05:58.388069 IP 138.197.133.108.22 > 162.243.188.66.58569: Flags [P.], seq 55792:56016, ack 1, win 502, options [nop,nop,TS val 2567627674 ecr 1829436672], length 224
20:05:58.388212 IP 138.197.133.108.22 > 162.243.188.66.58569: Flags [P.], seq 56016:56240, ack 1, win 502, options [nop,nop,TS val 2567627674 ecr 1829436672], length 224
20:05:58.388341 IP 138.197.133.108.22 > 162.243.188.66.58569: Flags [P.], seq 56240:56464, ack 1, win 502, options [nop,nop,TS val 2567627674 ecr 1829436672], length 224
20:05:58.388458 IP 138.197.133.108.22 > 162.243.188.66.58569: Flags [P.], seq 56464:56688, ack 1, win 502, options [nop,nop,TS val 2567627674 ecr 1829436672], length 224
20:05:58.388598 IP 138.197.133.108.22 > 162.243.188.66.58569: Flags [P.], seq 56688:56912, ack 1, win 502, options [nop,nop,TS val 2567627674 ecr 1829436672], length 224
20:05:58.388726 IP 138.197.133.108.22 > 162.243.188.66.58569: Flags [P.], seq 56912:57136, ack 1, win 502, options [nop,nop,TS val 2567627674 ecr 1829436672], length 224
20:05:58.388835 IP 138.197.133.108.22 > 162.243.188.66.58569: Flags [P.], seq 57136:57360, ack 1, win 502, options [nop,nop,TS val 2567627675 ecr 1829436672], length 224
20:05:58.388952 IP 138.197.133.108.22 > 162.243.188.66.58569: Flags [P.], seq 57360:57584, ack 1, win 502, options [nop,nop,TS val 2567627675 ecr 1829436672], length 224
20:05:58.389073 IP 138.197.133.108.22 > 162.243.188.66.58569: Flags [P.], seq 57584:57808, ack 1, win 502, options [nop,nop,TS val 2567627675 ecr 1829436672], length 224
20:05:58.389201 IP 138.197.133.108.22 > 162.243.188.66.58569: Flags [P.], seq 57808:58032, ack 1, win 502, options [nop,nop,TS val 2567627675 ecr 1829436672], length 224
20:05:58.389317 IP 138.197.133.108.22 > 162.243.188.66.58569: Flags [P.], seq 58032:58256, ack 1, win 502, options [nop,nop,TS val 2567627675 ecr 1829436672], length 224
20:05:58.389429 IP 138.197.133.108.22 > 162.243.188.66.58569: Flags [P.], seq 58256:58480, ack 1, win 502, options [nop,nop,TS val 2567627675 ecr 1829436672], length 224
20:05:58.389563 IP 138.197.133.108.22 > 162.243.188.66.58569: Flags [P.], seq 58480:58704, ack 1, win 502, options [nop,nop,TS val 2567627675 ecr 1829436672], length 224
20:05:58.389684 IP 138.197.133.108.22 > 162.243.188.66.58569: Flags [P.], seq 58704:58928, ack 1, win 502, options [nop,nop,TS val 2567627675 ecr 1829436672], length 224
20:05:58.389796 IP 138.197.133.108.22 > 162.243.188.66.58569: Flags [P.], seq 58928:59152, ack 1, win 502, options [nop,nop,TS val 2567627676 ecr 1829436672], length 224
20:05:58.389919 IP 138.197.133.108.22 > 162.243.188.66.58569: Flags [P.], seq 59152:59376, ack 1, win 502, options [nop,nop,TS val 2567627676 ecr 1829436672], length 224
20:05:58.390045 IP 138.197.133.108.22 > 162.243.188.66.58569: Flags [P.], seq 59376:59600, ack 1, win 502, options [nop,nop,TS val 2567627676 ecr 1829436672], length 224
20:05:58.390154 IP 138.197.133.108.22 > 162.243.188.66.58569: Flags [P.], seq 59600:59824, ack 1, win 502, options [nop,nop,TS val 2567627676 ecr 1829436672], length 224
20:05:58.390265 IP 138.197.133.108.22 > 162.243.188.66.58569: Flags [P.], seq 59824:60048, ack 1, win 502, options [nop,nop,TS val 2567627676 ecr 1829436672], length 224
20:05:58.390391 IP 138.197.133.108.22 > 162.243.188.66.58569: Flags [P.], seq 60048:60272, ack 1, win 502, options [nop,nop,TS val 2567627676 ecr 1829436672], length 224
20:05:58.390502 IP 138.197.133.108.22 > 162.243.188.66.58569: Flags [P.], seq 60272:60496, ack 1, win 502, options [nop,nop,TS val 2567627676 ecr 1829436672], length 224
20:05:58.390611 IP 138.197.133.108.22 > 162.243.188.66.58569: Flags [P.], seq 60496:60720, ack 1, win 502, options [nop,nop,TS val 2567627676 ecr 1829436672], length 224
20:05:58.390740 IP 138.197.133.108.22 > 162.243.188.66.58569: Flags [P.], seq 60720:60944, ack 1, win 502, options [nop,nop,TS val 2567627676 ecr 1829436672], length 224
20:05:58.390859 IP 138.197.133.108.22 > 162.243.188.66.58569: Flags [P.], seq 60944:61168, ack 1, win 502, options [nop,nop,TS val 2567627677 ecr 1829436672], length 224
20:05:58.390972 IP 138.197.133.108.22 > 162.243.188.66.58569: Flags [P.], seq 61168:61392, ack 1, win 502, options [nop,nop,TS val 2567627677 ecr 1829436672], length 224
20:05:58.391095 IP 138.197.133.108.22 > 162.243.188.66.58569: Flags [P.], seq 61392:61616, ack 1, win 502, options [nop,nop,TS val 2567627677 ecr 1829436672], length 224
20:05:58.391219 IP 138.197.133.108.22 > 162.243.188.66.58569: Flags [P.], seq 61616:61840, ack 1, win 502, options [nop,nop,TS val 2567627677 ecr 1829436672], length 224
20:05:58.391345 IP 138.197.133.108.22 > 162.243.188.66.58569: Flags [P.], seq 61840:62064, ack 1, win 502, options [nop,nop,TS val 2567627677 ecr 1829436672], length 224
20:05:58.391467 IP 138.197.133.108.22 > 162.243.188.66.58569: Flags [P.], seq 62064:62288, ack 1, win 502, options [nop,nop,TS val 2567627677 ecr 1829436672], length 224
20:05:58.391589 IP 138.197.133.108.22 > 162.243.188.66.58569: Flags [P.], seq 62288:62512, ack 1, win 502, options [nop,nop,TS val 2567627677 ecr 1829436672], length 224
20:05:58.391704 IP 138.197.133.108.22 > 162.243.188.66.58569: Flags [P.], seq 62512:62736, ack 1, win 502, options [nop,nop,TS val 2567627677 ecr 1829436672], length 224
20:05:58.391819 IP 138.197.133.108.22 > 162.243.188.66.58569: Flags [P.], seq 62736:62960, ack 1, win 502, options [nop,nop,TS val 2567627678 ecr 1829436672], length 224
20:05:58.391934 IP 138.197.133.108.22 > 162.243.188.66.58569: Flags [P.], seq 62960:63184, ack 1, win 502, options [nop,nop,TS val 2567627678 ecr 1829436672], length 224
20:05:58.392065 IP 138.197.133.108.22 > 162.243.188.66.58569: Flags [P.], seq 63184:63408, ack 1, win 502, options [nop,nop,TS val 2567627678 ecr 1829436672], length 224
20:05:58.392190 IP 138.197.133.108.22 > 162.243.188.66.58569: Flags [P.], seq 63408:63632, ack 1, win 502, options [nop,nop,TS val 2567627678 ecr 1829436672], length 224
20:05:58.392311 IP 138.197.133.108.22 > 162.243.188.66.58569: Flags [P.], seq 63632:63856, ack 1, win 502, options [nop,nop,TS val 2567627678 ecr 1829436672], length 224
20:05:58.392430 IP 138.197.133.108.22 > 162.243.188.66.58569: Flags [P.], seq 63856:64080, ack 1, win 502, options [nop,nop,TS val 2567627678 ecr 1829436672], length 224
20:05:58.392571 IP 138.197.133.108.22 > 162.243.188.66.58569: Flags [P.], seq 64080:64304, ack 1, win 502, options [nop,nop,TS val 2567627678 ecr 1829436672], length 224
20:05:58.392691 IP 138.197.133.108.22 > 162.243.188.66.58569: Flags [P.], seq 64304:64528, ack 1, win 502, options [nop,nop,TS val 2567627678 ecr 1829436672], length 224
20:05:58.392808 IP 138.197.133.108.22 > 162.243.188.66.58569: Flags [P.], seq 64528:64752, ack 1, win 502, options [nop,nop,TS val 2567627679 ecr 1829436672], length 224
20:05:58.392923 IP 138.197.133.108.22 > 162.243.188.66.58569: Flags [P.], seq 64752:64976, ack 1, win 502, options [nop,nop,TS val 2567627679 ecr 1829436672], length 224
20:05:58.393064 IP 138.197.133.108.22 > 162.243.188.66.58569: Flags [P.], seq 64976:65200, ack 1, win 502, options [nop,nop,TS val 2567627679 ecr 1829436672], length 224
20:05:58.393187 IP 138.197.133.108.22 > 162.243.188.66.58569: Flags [P.], seq 65200:65424, ack 1, win 502, options [nop,nop,TS val 2567627679 ecr 1829436672], length 224
20:05:58.393305 IP 138.197.133.108.22 > 162.243.188.66.58569: Flags [P.], seq 65424:65648, ack 1, win 502, options [nop,nop,TS val 2567627679 ecr 1829436672], length 224
20:05:58.393455 IP 138.197.133.108.22 > 162.243.188.66.58569: Flags [P.], seq 65648:65872, ack 1, win 502, options [nop,nop,TS val 2567627679 ecr 1829436672], length 224
20:05:58.393612 IP 138.197.133.108.22 > 162.243.188.66.58569: Flags [P.], seq 65872:66096, ack 1, win 502, options [nop,nop,TS val 2567627679 ecr 1829436672], length 224
20:05:58.393751 IP 138.197.133.108.22 > 162.243.188.66.58569: Flags [P.], seq 66096:66320, ack 1, win 502, options [nop,nop,TS val 2567627679 ecr 1829436672], length 224
20:05:58.393865 IP 138.197.133.108.22 > 162.243.188.66.58569: Flags [P.], seq 66320:66544, ack 1, win 502, options [nop,nop,TS val 2567627680 ecr 1829436672], length 224
20:05:58.393999 IP 138.197.133.108.22 > 162.243.188.66.58569: Flags [P.], seq 66544:66768, ack 1, win 502, options [nop,nop,TS val 2567627680 ecr 1829436672], length 224
20:05:58.394123 IP 138.197.133.108.22 > 162.243.188.66.58569: Flags [P.], seq 66768:66992, ack 1, win 502, options [nop,nop,TS val 2567627680 ecr 1829436672], length 224
20:05:58.394237 IP 162.243.188.66.58569 > 138.197.133.108.22: Flags [.], ack 43472, win 198, options [nop,nop,TS val 1829436680 ecr 2567627660], length 0
20:05:58.394343 IP 138.197.133.108.22 > 162.243.188.66.58569: Flags [P.], seq 66992:67216, ack 1, win 502, options [nop,nop,TS val 2567627680 ecr 1829436680], length 224
20:05:58.394399 IP 138.197.133.108.22 > 162.243.188.66.58569: Flags [P.], seq 67216:67424, ack 1, win 502, options [nop,nop,TS val 2567627680 ecr 1829436680], length 208
20:05:58.394542 IP 138.197.133.108.22 > 162.243.188.66.58569: Flags [P.], seq 67424:67824, ack 1, win 502, options [nop,nop,TS val 2567627680 ecr 1829436680], length 400
20:05:58.394660 IP 138.197.133.108.22 > 162.243.188.66.58569: Flags [P.], seq 67824:68048, ack 1, win 502, options [nop,nop,TS val 2567627680 ecr 1829436680], length 224
20:05:58.394775 IP 138.197.133.108.22 > 162.243.188.66.58569: Flags [P.], seq 68048:68272, ack 1, win 502, options [nop,nop,TS val 2567627680 ecr 1829436680], length 224
20:05:58.394882 IP 138.197.133.108.22 > 162.243.188.66.58569: Flags [P.], seq 68272:68496, ack 1, win 502, options [nop,nop,TS val 2567627681 ecr 1829436680], length 224
20:05:58.395010 IP 138.197.133.108.22 > 162.243.188.66.58569: Flags [P.], seq 68496:68720, ack 1, win 502, options [nop,nop,TS val 2567627681 ecr 1829436680], length 224
20:05:58.395355 IP 162.243.188.66.58569 > 138.197.133.108.22: Flags [.], ack 44976, win 187, options [nop,nop,TS val 1829436681 ecr 2567627667], length 0
20:05:58.396241 IP 162.243.188.66.58569 > 138.197.133.108.22: Flags [.], ack 46480, win 176, options [nop,nop,TS val 1829436682 ecr 2567627668], length 0
20:05:58.396724 IP 162.243.188.66.58569 > 138.197.133.108.22: Flags [.], ack 47984, win 165, options [nop,nop,TS val 1829436682 ecr 2567627669], length 0
20:05:58.397809 IP 162.243.188.66.58569 > 138.197.133.108.22: Flags [.], ack 49536, win 153, options [nop,nop,TS val 1829436683 ecr 2567627670], length 0
20:05:58.398231 IP 162.243.188.66.58569 > 138.197.133.108.22: Flags [.], ack 50992, win 142, options [nop,nop,TS val 1829436684 ecr 2567627671], length 0
20:05:58.399023 IP 162.243.188.66.58569 > 138.197.133.108.22: Flags [.], ack 52496, win 131, options [nop,nop,TS val 1829436684 ecr 2567627671], length 0
20:05:58.399900 IP 162.243.188.66.58569 > 138.197.133.108.22: Flags [.], ack 54064, win 119, options [nop,nop,TS val 1829436685 ecr 2567627672], length 0
20:05:58.400673 IP 162.243.188.66.58569 > 138.197.133.108.22: Flags [.], ack 55568, win 108, options [nop,nop,TS val 1829436686 ecr 2567627673], length 0
20:05:58.401591 IP 162.243.188.66.58569 > 138.197.133.108.22: Flags [.], ack 57136, win 96, options [nop,nop,TS val 1829436687 ecr 2567627674], length 0
20:05:58.402397 IP 162.243.188.66.58569 > 138.197.133.108.22: Flags [.], ack 58704, win 97, options [nop,nop,TS val 1829436688 ecr 2567627675], length 0
20:05:58.402429 IP 138.197.133.108.22 > 162.243.188.66.58569: Flags [P.], seq 68720:70816, ack 1, win 502, options [nop,nop,TS val 2567627688 ecr 1829436688], length 2096
20:05:58.403385 IP 162.243.188.66.58569 > 138.197.133.108.22: Flags [.], ack 60272, win 85, options [nop,nop,TS val 1829436689 ecr 2567627675], length 0
20:05:58.404137 IP 162.243.188.66.58569 > 138.197.133.108.22: Flags [.], ack 61840, win 73, options [nop,nop,TS val 1829436690 ecr 2567627676], length 0
20:05:58.405261 IP 162.243.188.66.58569 > 138.197.133.108.22: Flags [.], ack 63408, win 61, options [nop,nop,TS val 1829436691 ecr 2567627677], length 0
20:05:58.405952 IP 162.243.188.66.58569 > 138.197.133.108.22: Flags [.], ack 64976, win 49, options [nop,nop,TS val 1829436691 ecr 2567627678], length 0
20:05:58.406712 IP 162.243.188.66.58569 > 138.197.133.108.22: Flags [.], ack 66544, win 37, options [nop,nop,TS val 1829436692 ecr 2567627679], length 0
20:05:58.406801 IP 162.243.188.66.58569 > 138.197.133.108.22: Flags [.], ack 66544, win 136, options [nop,nop,TS val 1829436692 ecr 2567627679], length 0
20:05:58.406819 IP 138.197.133.108.22 > 162.243.188.66.58569: Flags [P.], seq 70816:72032, ack 1, win 502, options [nop,nop,TS val 2567627693 ecr 1829436692], length 1216
20:05:58.406958 IP 138.197.133.108.22 > 162.243.188.66.58569: Flags [P.], seq 72032:72576, ack 1, win 502, options [nop,nop,TS val 2567627693 ecr 1829436692], length 544
20:05:58.407088 IP 138.197.133.108.22 > 162.243.188.66.58569: Flags [P.], seq 72576:72800, ack 1, win 502, options [nop,nop,TS val 2567627693 ecr 1829436692], length 224
20:05:58.407225 IP 138.197.133.108.22 > 162.243.188.66.58569: Flags [P.], seq 72800:73024, ack 1, win 502, options [nop,nop,TS val 2567627693 ecr 1829436692], length 224
20:05:58.407342 IP 138.197.133.108.22 > 162.243.188.66.58569: Flags [P.], seq 73024:73248, ack 1, win 502, options [nop,nop,TS val 2567627693 ecr 1829436692], length 224
20:05:58.407419 IP 162.243.188.66.58569 > 138.197.133.108.22: Flags [.], ack 68048, win 125, options [nop,nop,TS val 1829436693 ecr 2567627680], length 0
20:05:58.407527 IP 138.197.133.108.22 > 162.243.188.66.58569: Flags [P.], seq 73248:73632, ack 1, win 502, options [nop,nop,TS val 2567627693 ecr 1829436693], length 384
20:05:58.407797 IP 138.197.133.108.22 > 162.243.188.66.58569: Flags [P.], seq 73632:73856, ack 1, win 502, options [nop,nop,TS val 2567627694 ecr 1829436693], length 224
20:05:58.407922 IP 138.197.133.108.22 > 162.243.188.66.58569: Flags [P.], seq 73856:74080, ack 1, win 502, options [nop,nop,TS val 2567627694 ecr 1829436693], length 224
20:05:58.408069 IP 138.197.133.108.22 > 162.243.188.66.58569: Flags [P.], seq 74080:74304, ack 1, win 502, options [nop,nop,TS val 2567627694 ecr 1829436693], length 224
20:05:58.408198 IP 138.197.133.108.22 > 162.243.188.66.58569: Flags [P.], seq 74304:74528, ack 1, win 502, options [nop,nop,TS val 2567627694 ecr 1829436693], length 224
20:05:58.408324 IP 138.197.133.108.22 > 162.243.188.66.58569: Flags [P.], seq 74528:74752, ack 1, win 502, options [nop,nop,TS val 2567627694 ecr 1829436693], length 224
20:05:58.408447 IP 138.197.133.108.22 > 162.243.188.66.58569: Flags [P.], seq 74752:74976, ack 1, win 502, options [nop,nop,TS val 2567627694 ecr 1829436693], length 224
20:05:58.408605 IP 138.197.133.108.22 > 162.243.188.66.58569: Flags [P.], seq 74976:75200, ack 1, win 502, options [nop,nop,TS val 2567627694 ecr 1829436693], length 224
20:05:58.408723 IP 138.197.133.108.22 > 162.243.188.66.58569: Flags [P.], seq 75200:75424, ack 1, win 502, options [nop,nop,TS val 2567627694 ecr 1829436693], length 224
20:05:58.408851 IP 138.197.133.108.22 > 162.243.188.66.58569: Flags [P.], seq 75424:75648, ack 1, win 502, options [nop,nop,TS val 2567627695 ecr 1829436693], length 224
20:05:58.408985 IP 138.197.133.108.22 > 162.243.188.66.58569: Flags [P.], seq 75648:75872, ack 1, win 502, options [nop,nop,TS val 2567627695 ecr 1829436693], length 224
20:05:58.409102 IP 138.197.133.108.22 > 162.243.188.66.58569: Flags [P.], seq 75872:76096, ack 1, win 502, options [nop,nop,TS val 2567627695 ecr 1829436693], length 224
20:05:58.409280 IP 138.197.133.108.22 > 162.243.188.66.58569: Flags [P.], seq 76096:76320, ack 1, win 502, options [nop,nop,TS val 2567627695 ecr 1829436693], length 224
20:05:58.409405 IP 138.197.133.108.22 > 162.243.188.66.58569: Flags [P.], seq 76320:76544, ack 1, win 502, options [nop,nop,TS val 2567627695 ecr 1829436693], length 224
20:05:58.409526 IP 138.197.133.108.22 > 162.243.188.66.58569: Flags [P.], seq 76544:76768, ack 1, win 502, options [nop,nop,TS val 2567627695 ecr 1829436693], length 224
20:05:58.409644 IP 138.197.133.108.22 > 162.243.188.66.58569: Flags [P.], seq 76768:76992, ack 1, win 502, options [nop,nop,TS val 2567627695 ecr 1829436693], length 224
20:05:58.409819 IP 138.197.133.108.22 > 162.243.188.66.58569: Flags [P.], seq 76992:77216, ack 1, win 502, options [nop,nop,TS val 2567627696 ecr 1829436693], length 224
20:05:58.409941 IP 138.197.133.108.22 > 162.243.188.66.58569: Flags [P.], seq 77216:77440, ack 1, win 502, options [nop,nop,TS val 2567627696 ecr 1829436693], length 224
20:05:58.410054 IP 138.197.133.108.22 > 162.243.188.66.58569: Flags [P.], seq 77440:77664, ack 1, win 502, options [nop,nop,TS val 2567627696 ecr 1829436693], length 224
20:05:58.410174 IP 138.197.133.108.22 > 162.243.188.66.58569: Flags [P.], seq 77664:77888, ack 1, win 502, options [nop,nop,TS val 2567627696 ecr 1829436693], length 224
20:05:58.410351 IP 138.197.133.108.22 > 162.243.188.66.58569: Flags [P.], seq 77888:78112, ack 1, win 502, options [nop,nop,TS val 2567627696 ecr 1829436693], length 224
20:05:58.410483 IP 138.197.133.108.22 > 162.243.188.66.58569: Flags [P.], seq 78112:78336, ack 1, win 502, options [nop,nop,TS val 2567627696 ecr 1829436693], length 224
20:05:58.410609 IP 138.197.133.108.22 > 162.243.188.66.58569: Flags [P.], seq 78336:78560, ack 1, win 502, options [nop,nop,TS val 2567627696 ecr 1829436693], length 224
20:05:58.410722 IP 138.197.133.108.22 > 162.243.188.66.58569: Flags [P.], seq 78560:78784, ack 1, win 502, options [nop,nop,TS val 2567627696 ecr 1829436693], length 224
20:05:58.410836 IP 138.197.133.108.22 > 162.243.188.66.58569: Flags [P.], seq 78784:79008, ack 1, win 502, options [nop,nop,TS val 2567627697 ecr 1829436693], length 224
20:05:58.410951 IP 138.197.133.108.22 > 162.243.188.66.58569: Flags [P.], seq 79008:79232, ack 1, win 502, options [nop,nop,TS val 2567627697 ecr 1829436693], length 224
20:05:58.411065 IP 138.197.133.108.22 > 162.243.188.66.58569: Flags [P.], seq 79232:79456, ack 1, win 502, options [nop,nop,TS val 2567627697 ecr 1829436693], length 224
20:05:58.411198 IP 138.197.133.108.22 > 162.243.188.66.58569: Flags [P.], seq 79456:79680, ack 1, win 502, options [nop,nop,TS val 2567627697 ecr 1829436693], length 224
20:05:58.411315 IP 138.197.133.108.22 > 162.243.188.66.58569: Flags [P.], seq 79680:79904, ack 1, win 502, options [nop,nop,TS val 2567627697 ecr 1829436693], length 224
20:05:58.411428 IP 138.197.133.108.22 > 162.243.188.66.58569: Flags [P.], seq 79904:80128, ack 1, win 502, options [nop,nop,TS val 2567627697 ecr 1829436693], length 224
